{
  "schema_version": "MODEL-ASSIST-V1.0",
  "generated_at": "2026-10-26T03:37:28.416Z",
  "data_date": "2026-10-26",
  "prompt_version": "model-assist-2026-07-18.2",
  "source_count": 95,
  "candidates": [
    {
      "candidate_id": "MAC-02287459f17dddc1",
      "task_type": "entity_resolution",
      "asset_id": "EN-2a914cf25d5fb0a1",
      "raw_id": "RAW-91dfd6a25eae95e6",
      "source_ref": "SA-74da668e7e74ac55",
      "source_hash": "80d6052be0efbbc2",
      "provider": "deepseek",
      "model": "deepseek-flash",
      "prompt_version": "model-assist-2026-07-18.2",
      "status": "requires_review",
      "proposal": {
        "decision": "distinct_entity",
        "canonical_name": "前OpenAI研究主管Bob McGrew创办的AI制造软件公司Arda",
        "rationale": "The candidate is the company Arda founded by Bob McGrew, not OpenAI. The verified alternative is OpenAI, which appears only as McGrew's former employer and is a different entity.",
        "candidate_name": "前OpenAI研究主管Bob McGrew创办的AI制造软件公司Arda"
      },
      "evidence": [
        {
          "start": 0,
          "end": 54,
          "quote": "前OpenAI研究主管Bob McGrew创办的AI制造软件公司Arda完成2.3亿美元融资，估值15亿美元"
        }
      ],
      "gate_results": [
        {
          "gate": "source_hash",
          "status": "passed",
          "detail": "source hash matches"
        },
        {
          "gate": "exact_source_span",
          "status": "passed",
          "detail": "all quotes match exact spans"
        },
        {
          "gate": "protected_facts",
          "status": "passed",
          "detail": "all proposal numbers occur in evidence"
        },
        {
          "gate": "task_contract",
          "status": "passed",
          "detail": "task contract passed"
        }
      ],
      "generated_at": "2026-10-26T00:41:00.315Z"
    },
    {
      "candidate_id": "MAC-0368dc34875afc6b",
      "task_type": "claim_extraction",
      "asset_id": "QA-b91ed671ea6cd4c0",
      "raw_id": "RAW-aa48b35cac993e9e",
      "source_ref": "SA-6a4f3690afc078f3",
      "source_hash": "e1cc838f51310a71",
      "provider": "deepseek",
      "model": "deepseek-flash",
      "prompt_version": "model-assist-2026-07-18.2",
      "status": "rejected",
      "proposal": {
        "claims": []
      },
      "evidence": [],
      "gate_results": [
        {
          "gate": "source_hash",
          "status": "passed",
          "detail": "source hash matches"
        },
        {
          "gate": "exact_source_span",
          "status": "failed",
          "detail": "missing_source_evidence"
        },
        {
          "gate": "protected_facts",
          "status": "passed",
          "detail": "all proposal numbers occur in evidence"
        },
        {
          "gate": "task_contract",
          "status": "failed",
          "detail": "missing_claim_proposal"
        }
      ],
      "generated_at": "2026-10-26T00:40:54.991Z"
    },
    {
      "candidate_id": "MAC-0383e56927b40acf",
      "task_type": "qa_repair",
      "asset_id": "QA-8bc91efb9ce4661d",
      "raw_id": "RAW-5b0d52b6fafb9f0e",
      "source_ref": "SA-1c69e45969466cee",
      "source_hash": "a7103d79867fd0a0",
      "provider": "deepseek",
      "model": "deepseek-flash",
      "prompt_version": "model-assist-2026-07-18.2",
      "status": "rejected",
      "proposal": {
        "action": "extract_claim",
        "reason": "Source contains a concrete AI funding event: 辉羲智能 completed Pre-B+ and B rounds with cumulative equity financing over 2.5 billion yuan in 2026, led by 北京市人工智能产业投资基金.",
        "claims": [
          {
            "event_type": "funding",
            "subject": "辉羲智能",
            "object": "Pre-B+及B轮融资，2026年内累计股权融资规模超25亿元",
            "evidence_index": 0
          },
          {
            "event_type": "funding",
            "subject": "北京市人工智能产业投资基金",
            "object": "领投辉羲智能Pre-B+及B轮融资",
            "evidence_index": 1
          }
        ]
      },
      "evidence": [
        {
          "start": 101,
          "end": 146,
          "quote": "辉羲智能宣布相继完成Pre-B+及B轮融资，公司2026年内累计股权融资规模已超25亿元。"
        },
        {
          "start": 146,
          "end": 166,
          "quote": "本次融资由北京市人工智能产业投资基金领投"
        }
      ],
      "gate_results": [
        {
          "gate": "source_hash",
          "status": "passed",
          "detail": "source hash matches"
        },
        {
          "gate": "exact_source_span",
          "status": "passed",
          "detail": "all quotes match exact spans"
        },
        {
          "gate": "protected_facts",
          "status": "failed",
          "detail": "unsupported_numeric_fact:2.5b"
        },
        {
          "gate": "task_contract",
          "status": "passed",
          "detail": "task contract passed"
        }
      ],
      "generated_at": "2026-10-26T00:41:20.635Z"
    },
    {
      "candidate_id": "MAC-05f84d58d412a5f4",
      "task_type": "entity_resolution",
      "asset_id": "EN-858326bb020621c2",
      "raw_id": "RAW-d7a72bb36cdc1e52",
      "source_ref": "SA-e6adcef1092c268e",
      "source_hash": "a002bc8d01b7b8dd",
      "provider": "deepseek",
      "model": "deepseek-flash",
      "prompt_version": "model-assist-2026-07-18.2",
      "status": "requires_review",
      "proposal": {
        "decision": "distinct_entity",
        "canonical_name": "华瑞指数云",
        "rationale": "候选实体为华瑞指数云，与已验证备选 Microsoft（微软）不是同一实体。SOURCE_TEXT 中仅提及核心成员来自微软，属于人员背景，不构成华瑞指数云与 Microsoft 的实体同一性。",
        "candidate_name": "华瑞指数云"
      },
      "evidence": [
        {
          "start": 1009,
          "end": 1035,
          "quote": "核心成员来自华为、腾讯、IBM、微软、EMC 等企业"
        }
      ],
      "gate_results": [
        {
          "gate": "source_hash",
          "status": "passed",
          "detail": "source hash matches"
        },
        {
          "gate": "exact_source_span",
          "status": "passed",
          "detail": "all quotes match exact spans"
        },
        {
          "gate": "protected_facts",
          "status": "passed",
          "detail": "all proposal numbers occur in evidence"
        },
        {
          "gate": "task_contract",
          "status": "passed",
          "detail": "task contract passed"
        }
      ],
      "generated_at": "2026-10-26T00:41:06.004Z"
    },
    {
      "candidate_id": "MAC-0827fc7f83632ccf",
      "task_type": "entity_resolution",
      "asset_id": "EN-f6f80d61fa45679e",
      "raw_id": "RAW-c2aa7756534985a6",
      "source_ref": "SA-3168d5c4b4804698",
      "source_hash": "ab1f1503f68afec9",
      "provider": "deepseek",
      "model": "deepseek-flash",
      "prompt_version": "model-assist-2026-07-18.2",
      "status": "requires_review",
      "proposal": {
        "decision": "unknown",
        "canonical_name": "星忆智能",
        "rationale": "No VERIFIED_ALTERNATIVE was supplied, so identity cannot be confirmed against a verified alternative. The source does show the candidate name 星忆智能 referring to 星忆科技（北京）有限公司, but without a verified alternative this remains advisory and requires review.",
        "candidate_name": "星忆智能"
      },
      "evidence": [
        {
          "start": 0,
          "end": 33,
          "quote": "星忆科技（北京）有限公司（下称“星忆智能”）孵化于清华大学计算机系"
        }
      ],
      "gate_results": [
        {
          "gate": "source_hash",
          "status": "passed",
          "detail": "source hash matches"
        },
        {
          "gate": "exact_source_span",
          "status": "passed",
          "detail": "all quotes match exact spans"
        },
        {
          "gate": "protected_facts",
          "status": "passed",
          "detail": "all proposal numbers occur in evidence"
        },
        {
          "gate": "task_contract",
          "status": "passed",
          "detail": "task contract passed"
        }
      ],
      "generated_at": "2026-10-26T00:41:10.892Z"
    },
    {
      "candidate_id": "MAC-108396cd636ab9c5",
      "task_type": "entity_resolution",
      "asset_id": "EN-b252622f7f344603",
      "raw_id": "RAW-64ac9e639415ad1a",
      "source_ref": "SA-65390f6a68556c5f",
      "source_hash": "23901e3c9a184982",
      "provider": "deepseek",
      "model": "deepseek-flash",
      "prompt_version": "model-assist-2026-07-18.2",
      "status": "rejected",
      "proposal": {
        "decision": "unknown",
        "canonical_name": "Toward More Efficient AI",
        "rationale": "The candidate name appears only as part of the post title 'Toward More Efficient AI: Leading Flapping Airplanes’ $1B Series A,' which is a title, not a mention of an organization. No VERIFIED_ALTERNATIVES are supplied, so identity cannot be confirmed.",
        "candidate_name": "Toward More Efficient AI"
      },
      "evidence": [],
      "gate_results": [
        {
          "gate": "source_hash",
          "status": "passed",
          "detail": "source hash matches"
        },
        {
          "gate": "exact_source_span",
          "status": "failed",
          "detail": "missing_source_evidence"
        },
        {
          "gate": "protected_facts",
          "status": "failed",
          "detail": "unsupported_numeric_fact:$1b"
        },
        {
          "gate": "task_contract",
          "status": "passed",
          "detail": "task contract passed"
        }
      ],
      "generated_at": "2026-10-26T03:37:23.120Z"
    },
    {
      "candidate_id": "MAC-11646045207769c3",
      "task_type": "claim_extraction",
      "asset_id": "QA-b7fd93e451ff2f3e",
      "raw_id": "RAW-f502c9e58a4e423a",
      "source_ref": "SA-9613ab8a5488c0bf",
      "source_hash": "246e22196b59617f",
      "provider": "deepseek",
      "model": "deepseek-flash",
      "prompt_version": "model-assist-2026-07-18.2",
      "status": "accepted",
      "proposal": {
        "claims": [
          {
            "event_type": "funding",
            "subject": "熵简科技",
            "object": "C轮融资，由蚂蚁集团领投，东方国信与乔贝资本跟投",
            "evidence_index": 0
          },
          {